<xs:schema xmlns:xs="http://www.w3.org/2001/XMLSchema">
    <xs:element name="catalog">
        <xs:complexType>
            <xs:sequence>
                <xs:element name="book" maxOccurs="unbounded">
                    <xs:complexType>
                        <xs:sequence>
                            <xs:element name="title" type="xs:string"></xs:element>
                            <xs:element name="author" type="xs:string"></xs:element>
                            <xs:element name="year">
                                <xs:simpleType>
                                    <xs:restriction base="xs:integer">
                                            <xs:minInclusive value="2015"></xs:minInclusive>
                                            <xs:maxInclusive value="2025"></xs:maxInclusive>
                                        </xs:restriction>
                                </xs:simpleType>
                            </xs:element>
                            <xs:element name="additional-info" minOccurs="0" maxOccurs="2">
                                <xs:complexType>
                                    <xs:sequence>
                                        <xs:element name="review"></xs:element>
                                    </xs:sequence>
                                </xs:complexType>
                            </xs:element>
                        </xs:sequence>
                        <xs:attribute name="id" type="xs:string" use="required"></xs:attribute>
                    </xs:complexType>
                </xs:element>
            </xs:sequence>
        </xs:complexType>
    </xs:element>
</xs:schema>